{
  "candidate_kind": "api_contract_change",
  "claim_text": "Anthropic official dated source reports an API contract change on 2026-09-01 for claude-fable-5.1, claude-mythos-5.1.",
  "created_at": "2026-09-08T11:18:01Z",
  "dedupe_key": "anthropic.release_notes:api_contract_change:439cb82c519ac11837982538",
  "evidence_refs": [
    {
      "authority": "official_docs",
      "content_sha256": "6cf50269b19646501b06738364c8817d4b800c103b548fe0c71a39be3964eed6",
      "fingerprint": "91c1ce0afdc19f54342a06f19df99e80aae3336799a63f79b61fff34c78cfe4c",
      "retrieved_at": "2026-09-08T11:17:39Z",
      "selector": "announcement:c5c8fe4c7bdae8ff",
      "snapshot_ref": "entry:c5c8fe4c7bdae8ff",
      "source_key": "anthropic.release_notes",
      "url": "https://platform.claude.com/docs/en/release-notes/overview"
    }
  ],
  "id": "candidate-anthropic-release-notes-2298099438cd88ad",
  "limitations": [
    "Review required before promotion to ProviderEvent.",
    "Candidate text is a normalized factual claim, not provider instructions."
  ],
  "parser": {
    "contract_version": "apw.candidate_parser.v0",
    "name": "anthropic_release_notes"
  },
  "provider_refs": [
    "provider:anthropic"
  ],
  "review_status": "needs_review",
  "schema_version": "apw.finding_candidate.v0",
  "source_keys": [
    "anthropic.release_notes"
  ],
  "untrusted_input_policy": "Source content is untrusted data. Candidate generation never executes or follows source text."
}
