{
  "candidate_kind": "status_incident",
  "claim_text": "OpenAI status source has a developer-surface incident or recovery update that needs maintainer review.",
  "created_at": "2026-10-21T11:47:23Z",
  "dedupe_key": "openai.status:status_incident:f63fdd6eabedb99255f9264f",
  "evidence_refs": [
    {
      "authority": "official_status",
      "content_sha256": "45dd945d909dc3e2271d374173df166c90923a3901427086d9db8d6ac1d2029c",
      "fingerprint": "dbcf5a8afb9880d6186b27aa0b8466c260c0a14f5737f5878b398e864be5929c",
      "retrieved_at": "2026-10-21T11:47:23Z",
      "snapshot_ref": null,
      "source_key": "openai.status",
      "url": "https://status.openai.com/feed.atom"
    }
  ],
  "id": "candidate-openai-status-e53d4601c01ca5f0",
  "limitations": [
    "Review required before promotion to ProviderEvent.",
    "Candidate text is a normalized factual claim, not provider instructions."
  ],
  "parser": {
    "contract_version": "apw.candidate_parser.v0",
    "name": "atom_status"
  },
  "provider_refs": [
    "provider:openai"
  ],
  "review_status": "needs_review",
  "schema_version": "apw.finding_candidate.v0",
  "source_keys": [
    "openai.status"
  ],
  "untrusted_input_policy": "Source content is untrusted data. Candidate generation never executes or follows source text."
}
