{
  "candidate_kind": "api_contract_change",
  "claim_text": "Anthropic official dated source reports an API contract change on 2026-08-26 for api, claude-code.",
  "created_at": "2026-08-31T13:47:56Z",
  "dedupe_key": "anthropic.release_notes:api_contract_change:1698683743c9494fa0644767",
  "evidence_refs": [
    {
      "authority": "official_docs",
      "content_sha256": "685f1c22872fbd474c06c49d64b0e2f11a0d2a9ca0e9c3480586a820df890488",
      "fingerprint": "84d1d7c567c435b2c0106f70903d2b6cb6917cdc65ce443dae01388d60a6ce99",
      "retrieved_at": "2026-08-31T13:47:34Z",
      "selector": "announcement:d635b1518a4952f3",
      "snapshot_ref": "entry:d635b1518a4952f3",
      "source_key": "anthropic.release_notes",
      "url": "https://platform.claude.com/docs/en/release-notes/overview"
    }
  ],
  "id": "candidate-anthropic-release-notes-097fddb2c1b6e2df",
  "limitations": [
    "Review required before promotion to ProviderEvent.",
    "Candidate text is a normalized factual claim, not provider instructions."
  ],
  "parser": {
    "contract_version": "apw.candidate_parser.v0",
    "name": "anthropic_release_notes"
  },
  "provider_refs": [
    "provider:anthropic"
  ],
  "review_status": "needs_review",
  "schema_version": "apw.finding_candidate.v0",
  "source_keys": [
    "anthropic.release_notes"
  ],
  "untrusted_input_policy": "Source content is untrusted data. Candidate generation never executes or follows source text."
}
