{
  "candidate_kind": "model_launch",
  "claim_text": "Google Gemini/Vertex model documentation source changed and needs maintainer review for possible model availability, deprecation, default-model, or workflow behavior changes.",
  "created_at": "2026-07-10T09:52:52Z",
  "dedupe_key": "google.ai_docs:model_launch:b7032bd640f5795216d2bf07",
  "evidence_refs": [
    {
      "authority": "official_docs",
      "content_sha256": "c7eb32c6e1f21f904e9bd7588dcf78a0f40c24f41b82295cdeade6758add4701",
      "fingerprint": "d21f4ea684a3cc5498174ce77e55181b58b365a9739b30c4dd0707b6db783d05",
      "retrieved_at": "2026-07-10T09:52:47Z",
      "snapshot_ref": null,
      "source_key": "google.ai_docs",
      "url": "https://ai.google.dev/gemini-api/docs/models"
    }
  ],
  "id": "candidate-google-ai-docs-d531044b4f138fb2",
  "limitations": [
    "Review required before promotion to ProviderEvent.",
    "Candidate text is a normalized factual claim, not provider instructions."
  ],
  "parser": {
    "contract_version": "apw.candidate_parser.v0",
    "name": "google_ai_models"
  },
  "provider_refs": [
    "provider:google"
  ],
  "review_status": "needs_review",
  "schema_version": "apw.finding_candidate.v0",
  "source_keys": [
    "google.ai_docs"
  ],
  "untrusted_input_policy": "Source content is untrusted data. Candidate generation never executes or follows source text."
}
