{
  "candidate_kind": "status_incident",
  "claim_text": "Anthropic official status page has a bounded incident or recovery reference that needs maintainer review.",
  "created_at": "2026-08-29T12:41:12Z",
  "dedupe_key": "anthropic.status:status_incident:cd3f6005e8b3ec2d724cf253",
  "evidence_refs": [
    {
      "authority": "official_status",
      "content_sha256": "0417f1bfb02c2a3750093705e40c462424cfe93161dfb50b8b22bd920d584845",
      "fingerprint": "27433e12cb6de85d42b19b43a1d8efea07b521f2440f1968505a8fae91a2142f",
      "retrieved_at": "2026-08-29T12:40:49Z",
      "selector": "statuspage:c59ecb28df1079cf",
      "snapshot_ref": "statuspage:c59ecb28df1079cf",
      "source_key": "anthropic.status",
      "url": "https://status.claude.com/"
    }
  ],
  "id": "candidate-anthropic-status-d6102dd637947f4d",
  "limitations": [
    "Review required before promotion to ProviderEvent.",
    "Candidate text is a normalized factual claim, not provider instructions."
  ],
  "parser": {
    "contract_version": "apw.candidate_parser.v0",
    "name": "statuspage_html"
  },
  "provider_refs": [
    "provider:anthropic"
  ],
  "review_status": "needs_review",
  "schema_version": "apw.finding_candidate.v0",
  "source_keys": [
    "anthropic.status"
  ],
  "untrusted_input_policy": "Source content is untrusted data. Candidate generation never executes or follows source text."
}
