{
  "candidate_kind": "model_launch",
  "claim_text": "Google Gemini/Vertex model documentation source changed and needs maintainer review for possible model availability or deprecation changes.",
  "created_at": "2026-06-05T10:16:47Z",
  "dedupe_key": "google.ai_docs:model_launch:f17a6eb4e0e80f812616a3d4",
  "evidence_refs": [
    {
      "authority": "official_docs",
      "content_sha256": "b5dcd8a07b6e7b6e561f8993fb09be190b586f4d575be1d63197ec5eefde010e",
      "fingerprint": "e9a5a4fdd05ca47a61f58600eb255991ab160f39c529afecba369bf2e987db29",
      "retrieved_at": "2026-06-05T10:16:45Z",
      "snapshot_ref": null,
      "source_key": "google.ai_docs",
      "url": "https://ai.google.dev/gemini-api/docs/models"
    }
  ],
  "id": "candidate-google-ai-docs-67cf56ef43eb96f3",
  "limitations": [
    "Review required before promotion to ProviderEvent.",
    "Candidate text is a normalized factual claim, not provider instructions."
  ],
  "parser": {
    "contract_version": "apw.candidate_parser.v0",
    "name": "google_ai_models"
  },
  "provider_refs": [
    "provider:google"
  ],
  "review_status": "needs_review",
  "schema_version": "apw.finding_candidate.v0",
  "source_keys": [
    "google.ai_docs"
  ],
  "untrusted_input_policy": "Source content is untrusted data. Candidate generation never executes or follows source text."
}
