{
  "candidate_kind": "model_launch",
  "claim_text": "AWS Bedrock official dated source reports a model availability change on 2026-08-13 for amazon-bedrock, aws-bedrock, gpt-5.6, gpt-5.6-cyber.",
  "created_at": "2026-08-16T06:58:14Z",
  "dedupe_key": "aws_bedrock.whats_new:model_launch:770076029a6b229f61a92eaf",
  "evidence_refs": [
    {
      "authority": "official_blog",
      "content_sha256": "dbd9280e3db7cd2b71710f73adec897f08c33e0d554d7995d5c75b2338e0887b",
      "fingerprint": "e026741877e4089731e3453facaacd0e114e6c1f579eb9f422463d53dc44dd07",
      "retrieved_at": "2026-08-16T06:57:53Z",
      "selector": "announcement:5c538d6263933485",
      "snapshot_ref": "entry:5c538d6263933485",
      "source_key": "aws_bedrock.whats_new",
      "url": "https://aws.amazon.com/about-aws/whats-new/2026/08/openai-daybreak-red-and-blue-on-amazon-bedrock/"
    }
  ],
  "id": "candidate-aws-bedrock-whats-new-00a6e85564203877",
  "limitations": [
    "Review required before promotion to ProviderEvent.",
    "Candidate text is a normalized factual claim, not provider instructions."
  ],
  "parser": {
    "contract_version": "apw.candidate_parser.v0",
    "name": "aws_bedrock_whats_new_feed"
  },
  "provider_refs": [
    "provider:aws-bedrock"
  ],
  "review_status": "needs_review",
  "schema_version": "apw.finding_candidate.v0",
  "source_keys": [
    "aws_bedrock.whats_new"
  ],
  "untrusted_input_policy": "Source content is untrusted data. Candidate generation never executes or follows source text."
}
