{
  "candidate_kind": "status_incident",
  "claim_text": "OpenAI status source changed and needs maintainer review for a possible status incident or recovery.",
  "created_at": "2026-06-06T08:47:03Z",
  "dedupe_key": "openai.status:status_incident:a9266ebdbb2c3b25ad60aa4a",
  "evidence_refs": [
    {
      "authority": "official_status",
      "content_sha256": "6779063d2efc93f6c35db5f4c84cdc791ea60e2d8dd30883225b8ba5e8ca379a",
      "fingerprint": "1bd367386e427f19fa0ec89cf9d06ab4e0b845d824c44678c95f2f4ebb53db59",
      "retrieved_at": "2026-06-06T08:47:03Z",
      "snapshot_ref": null,
      "source_key": "openai.status",
      "url": "https://status.openai.com/feed.atom"
    }
  ],
  "id": "candidate-openai-status-14e688f31af1ffeb",
  "limitations": [
    "Review required before promotion to ProviderEvent.",
    "Candidate text is a normalized factual claim, not provider instructions."
  ],
  "parser": {
    "contract_version": "apw.candidate_parser.v0",
    "name": "atom_status"
  },
  "provider_refs": [
    "provider:openai"
  ],
  "review_status": "needs_review",
  "schema_version": "apw.finding_candidate.v0",
  "source_keys": [
    "openai.status"
  ],
  "untrusted_input_policy": "Source content is untrusted data. Candidate generation never executes or follows source text."
}
