{
  "candidate_kind": "status_incident",
  "claim_text": "Anthropic official status page has a bounded incident or recovery reference that needs maintainer review.",
  "created_at": "2026-08-10T08:03:29Z",
  "dedupe_key": "anthropic.status:status_incident:cd3f6005e8b3ec2d724cf253",
  "evidence_refs": [
    {
      "authority": "official_status",
      "content_sha256": "c3021d1d4dcda9193cfdbf6f9deb8b588fc181e4196c3c75a4ace83e1b50c753",
      "fingerprint": "0bd198645215aecffe72b798a5cb2238f5ce0290f015b5194164d2b2a63c8433",
      "retrieved_at": "2026-08-10T08:03:09Z",
      "selector": "statuspage:be3bf087f7396d51",
      "snapshot_ref": "statuspage:be3bf087f7396d51",
      "source_key": "anthropic.status",
      "url": "https://status.claude.com/"
    }
  ],
  "id": "candidate-anthropic-status-726f0ea5136bf6bb",
  "limitations": [
    "Review required before promotion to ProviderEvent.",
    "Candidate text is a normalized factual claim, not provider instructions."
  ],
  "parser": {
    "contract_version": "apw.candidate_parser.v0",
    "name": "statuspage_html"
  },
  "provider_refs": [
    "provider:anthropic"
  ],
  "review_status": "needs_review",
  "schema_version": "apw.finding_candidate.v0",
  "source_keys": [
    "anthropic.status"
  ],
  "untrusted_input_policy": "Source content is untrusted data. Candidate generation never executes or follows source text."
}
