{
  "candidate_kind": "pricing_change",
  "claim_text": "Azure OpenAI pricing source changed and needs maintainer review for possible pricing, token-accounting, cache, batch, or regional availability changes.",
  "created_at": "2026-06-10T10:32:54Z",
  "dedupe_key": "azure_openai.pricing:pricing_change:65b3bdd09019adce1ca01822",
  "evidence_refs": [
    {
      "authority": "official_pricing",
      "content_sha256": "2757873866d6a4c1b1e457adb6d745607f5ebb66d6686e605fe435af76438c28",
      "fingerprint": "934fc2a489ae71ceceb305940d8f7c1670bfa130c283ef3a16fe1b185f3ce2c4",
      "retrieved_at": "2026-06-10T10:32:34Z",
      "snapshot_ref": null,
      "source_key": "azure_openai.pricing",
      "url": "https://azure.microsoft.com/en-us/pricing/details/azure-openai/"
    }
  ],
  "id": "candidate-azure-openai-pricing-345f857b21f5e0b3",
  "limitations": [
    "Review required before promotion to ProviderEvent.",
    "Candidate text is a normalized factual claim, not provider instructions."
  ],
  "parser": {
    "contract_version": "apw.candidate_parser.v0",
    "name": "azure_openai_pricing"
  },
  "provider_refs": [
    "provider:azure-openai"
  ],
  "review_status": "needs_review",
  "schema_version": "apw.finding_candidate.v0",
  "source_keys": [
    "azure_openai.pricing"
  ],
  "untrusted_input_policy": "Source content is untrusted data. Candidate generation never executes or follows source text."
}
