{
  "candidate_kind": "pricing_change",
  "claim_text": "Google Gemini/Vertex official dated source reports a pricing change on 2026-10-06 for gemini-3.1-flash-image.",
  "created_at": "2026-10-09T13:15:31Z",
  "dedupe_key": "google.gemini_changelog:pricing_change:c314bd8e62df03f49174ad4e",
  "evidence_refs": [
    {
      "authority": "official_docs",
      "content_sha256": "eb9770570bd5a3b2a1614f0b343397e92b2b53ad66f5678ce73dfd2544d9a010",
      "fingerprint": "e103f36ccd2d80e6b3df44c651578bc3e343d54818128ceb6245e65071b46ffa",
      "retrieved_at": "2026-10-09T13:15:26Z",
      "selector": "announcement:55414ee10576e8ae",
      "snapshot_ref": "entry:55414ee10576e8ae",
      "source_key": "google.gemini_changelog",
      "url": "https://ai.google.dev/gemini-api/docs/changelog"
    }
  ],
  "id": "candidate-google-gemini-changelog-deae9c3148f4e930",
  "limitations": [
    "Review required before promotion to ProviderEvent.",
    "Candidate text is a normalized factual claim, not provider instructions."
  ],
  "parser": {
    "contract_version": "apw.candidate_parser.v0",
    "name": "google_gemini_changelog"
  },
  "provider_refs": [
    "provider:google"
  ],
  "review_status": "needs_review",
  "schema_version": "apw.finding_candidate.v0",
  "source_keys": [
    "google.gemini_changelog"
  ],
  "untrusted_input_policy": "Source content is untrusted data. Candidate generation never executes or follows source text."
}
