{
  "candidate_kind": "status_incident",
  "claim_text": "Anthropic official status page has a bounded incident or recovery reference that needs maintainer review.",
  "created_at": "2026-08-03T10:04:58Z",
  "dedupe_key": "anthropic.status:status_incident:cd3f6005e8b3ec2d724cf253",
  "evidence_refs": [
    {
      "authority": "official_status",
      "content_sha256": "ff4865037dbf1036efb6574d6df82705cb3082e99bb085a4e11688b0728d772c",
      "fingerprint": "0597ec845ff48ab4d2e64dfbd390685d713e869d82c7173d14d75c71fbcfa600",
      "retrieved_at": "2026-08-03T10:04:36Z",
      "selector": "statuspage:b0418af74fd64fd8",
      "snapshot_ref": "statuspage:b0418af74fd64fd8",
      "source_key": "anthropic.status",
      "url": "https://status.claude.com/"
    }
  ],
  "id": "candidate-anthropic-status-52f0281df2b3bf40",
  "limitations": [
    "Review required before promotion to ProviderEvent.",
    "Candidate text is a normalized factual claim, not provider instructions."
  ],
  "parser": {
    "contract_version": "apw.candidate_parser.v0",
    "name": "statuspage_html"
  },
  "provider_refs": [
    "provider:anthropic"
  ],
  "review_status": "needs_review",
  "schema_version": "apw.finding_candidate.v0",
  "source_keys": [
    "anthropic.status"
  ],
  "untrusted_input_policy": "Source content is untrusted data. Candidate generation never executes or follows source text."
}
