{
  "candidate_kind": "model_launch",
  "claim_text": "OpenAI official dated source reports a model availability change on 2026-07-06 for codex.",
  "created_at": "2026-07-08T08:43:46Z",
  "dedupe_key": "openai.codex_docs:model_launch:3387a6cab2a74644e4e33f63",
  "evidence_refs": [
    {
      "authority": "official_docs",
      "content_sha256": "fecaaa3709237e778cb548e76afaa1c8909d1761af35806eef62dc66f2f64e26",
      "fingerprint": "c333d7e175375c7e0f592b846a25897f1316ce54a6df49930a5ab552fa4cf99e",
      "retrieved_at": "2026-07-08T08:43:45Z",
      "selector": "announcement:8007a057d22159d2",
      "snapshot_ref": "entry:8007a057d22159d2",
      "source_key": "openai.codex_docs",
      "url": "https://developers.openai.com/codex/changelog"
    }
  ],
  "id": "candidate-openai-codex-docs-94206fc31da37aa3",
  "limitations": [
    "Review required before promotion to ProviderEvent.",
    "Candidate text is a normalized factual claim, not provider instructions."
  ],
  "parser": {
    "contract_version": "apw.candidate_parser.v0",
    "name": "openai_codex_changelog"
  },
  "provider_refs": [
    "provider:openai"
  ],
  "review_status": "needs_review",
  "schema_version": "apw.finding_candidate.v0",
  "source_keys": [
    "openai.codex_docs"
  ],
  "untrusted_input_policy": "Source content is untrusted data. Candidate generation never executes or follows source text."
}
