{
  "candidate_kind": "pricing_change",
  "claim_text": "AWS Bedrock official dated source reports a pricing change on 2026-10-23 for api, aws-bedrock, codex-sites, responses-api.",
  "created_at": "2026-10-24T10:58:04Z",
  "dedupe_key": "aws_bedrock.whats_new:pricing_change:6f49a172572388fd7663492f",
  "evidence_refs": [
    {
      "authority": "official_blog",
      "content_sha256": "ab3cc838fa363d93bcfd53df760a804f3ab12c32123739ed9bcdd3ee2035d1fc",
      "fingerprint": "e6976356a8a953722d3142d2597d60dd4d4d3724907dc3db76e7d5baeaed38fe",
      "retrieved_at": "2026-10-24T10:57:43Z",
      "selector": "announcement:fc2fd3051f4b1159",
      "snapshot_ref": "entry:fc2fd3051f4b1159",
      "source_key": "aws_bedrock.whats_new",
      "url": "https://aws.amazon.com/about-aws/whats-new/2026/10/bedrock-web-search-domain-user-location/"
    }
  ],
  "id": "candidate-aws-bedrock-whats-new-59c9c8dc83ce6930",
  "limitations": [
    "Review required before promotion to ProviderEvent.",
    "Candidate text is a normalized factual claim, not provider instructions."
  ],
  "parser": {
    "contract_version": "apw.candidate_parser.v0",
    "name": "aws_bedrock_whats_new_feed"
  },
  "provider_refs": [
    "provider:aws-bedrock"
  ],
  "review_status": "needs_review",
  "schema_version": "apw.finding_candidate.v0",
  "source_keys": [
    "aws_bedrock.whats_new"
  ],
  "untrusted_input_policy": "Source content is untrusted data. Candidate generation never executes or follows source text."
}
