{
  "candidate_kind": "model_launch",
  "claim_text": "Anthropic official dated source reports a model availability change on 2026-10-21 for api.",
  "created_at": "2026-10-29T12:58:56Z",
  "dedupe_key": "anthropic.release_notes:model_launch:55a96cec10d9a35e651d9eaf",
  "evidence_refs": [
    {
      "authority": "official_docs",
      "content_sha256": "6947446e827da7cc35d364e917b7b9510f0d739c27615d37bc7ce4a3e7dd747f",
      "fingerprint": "22fb211a8e58087fc4244fd7c7baf78de57b92df0a83ecaa1d909f153ecbf7ab",
      "retrieved_at": "2026-10-29T12:58:30Z",
      "selector": "announcement:9b642d7906e4b405",
      "snapshot_ref": "entry:9b642d7906e4b405",
      "source_key": "anthropic.release_notes",
      "url": "https://platform.claude.com/docs/en/release-notes/overview"
    }
  ],
  "id": "candidate-anthropic-release-notes-e5822ed748c169eb",
  "limitations": [
    "Review required before promotion to ProviderEvent.",
    "Candidate text is a normalized factual claim, not provider instructions."
  ],
  "parser": {
    "contract_version": "apw.candidate_parser.v0",
    "name": "anthropic_release_notes"
  },
  "provider_refs": [
    "provider:anthropic"
  ],
  "review_status": "needs_review",
  "schema_version": "apw.finding_candidate.v0",
  "source_keys": [
    "anthropic.release_notes"
  ],
  "untrusted_input_policy": "Source content is untrusted data. Candidate generation never executes or follows source text."
}
