{
  "candidate_kind": "pricing_change",
  "claim_text": "AWS Bedrock official dated source reports a pricing change on 2026-07-01 for amazon-bedrock, aws-bedrock, bedrock-agentcore.",
  "created_at": "2026-07-07T10:00:40Z",
  "dedupe_key": "aws_bedrock.whats_new:pricing_change:9e8a928339ecf2bb7e02bb5e",
  "evidence_refs": [
    {
      "authority": "official_blog",
      "content_sha256": "e8f888d0aeb2dfbc21001eb3fc498346bcb4b2db48d02536ba236fdc7ef0c753",
      "fingerprint": "865b46eb3e01276733f5e9336a299691849128bd0dca2d759b2e12c15924d945",
      "retrieved_at": "2026-07-07T10:00:17Z",
      "selector": "announcement:e390b191488d731c",
      "snapshot_ref": "entry:e390b191488d731c",
      "source_key": "aws_bedrock.whats_new",
      "url": "https://aws.amazon.com/about-aws/whats-new/2026/06/amazon-bedrock-agentcore-four-additional-regions/"
    }
  ],
  "id": "candidate-aws-bedrock-whats-new-b93f0e72ccc8d810",
  "limitations": [
    "Review required before promotion to ProviderEvent.",
    "Candidate text is a normalized factual claim, not provider instructions."
  ],
  "parser": {
    "contract_version": "apw.candidate_parser.v0",
    "name": "aws_bedrock_whats_new_feed"
  },
  "provider_refs": [
    "provider:aws-bedrock"
  ],
  "review_status": "needs_review",
  "schema_version": "apw.finding_candidate.v0",
  "source_keys": [
    "aws_bedrock.whats_new"
  ],
  "untrusted_input_policy": "Source content is untrusted data. Candidate generation never executes or follows source text."
}
