{
  "candidate_kind": "model_launch",
  "claim_text": "Anthropic official dated source reports a model availability change on 2026-07-24 for claude-opus-5.",
  "created_at": "2026-07-29T09:07:32Z",
  "dedupe_key": "anthropic.release_notes:model_launch:195eef3b31dab64c8f682829",
  "evidence_refs": [
    {
      "authority": "official_docs",
      "content_sha256": "ff129509028f57bbf87092d26e4963f790e0a71f028083ca11f602dc35d2f00b",
      "fingerprint": "7b99f535eeba576912177f7592121ff008e37ee072e54fe869f1c24777916042",
      "retrieved_at": "2026-07-29T09:07:11Z",
      "selector": "announcement:706e33f6dcf047e8",
      "snapshot_ref": "entry:706e33f6dcf047e8",
      "source_key": "anthropic.release_notes",
      "url": "https://platform.claude.com/docs/en/release-notes/overview"
    }
  ],
  "id": "candidate-anthropic-release-notes-ce1f2e0a9939a92f",
  "limitations": [
    "Review required before promotion to ProviderEvent.",
    "Candidate text is a normalized factual claim, not provider instructions."
  ],
  "parser": {
    "contract_version": "apw.candidate_parser.v0",
    "name": "anthropic_release_notes"
  },
  "provider_refs": [
    "provider:anthropic"
  ],
  "review_status": "needs_review",
  "schema_version": "apw.finding_candidate.v0",
  "source_keys": [
    "anthropic.release_notes"
  ],
  "untrusted_input_policy": "Source content is untrusted data. Candidate generation never executes or follows source text."
}
