{
  "candidate_kind": "pricing_change",
  "claim_text": "OpenAI official dated source reports a pricing change on 2026-08-07 for gpt-5.6, gpt-5.6-cyber.",
  "created_at": "2026-08-23T07:00:35Z",
  "dedupe_key": "openai.api_changelog:pricing_change:346d2048fc65f0dec120b34b",
  "evidence_refs": [
    {
      "authority": "official_docs",
      "content_sha256": "450a88e23de5156c8bd3f3cf5af98dc2fbae46c1be401ae80686cfa966218d21",
      "fingerprint": "3e53ecc30e3913a892e4be30a426efff535ccf95f09b639d857590ca9f6e9e1b",
      "retrieved_at": "2026-08-23T07:00:33Z",
      "selector": "announcement:7127299d1baf01ec",
      "snapshot_ref": "entry:7127299d1baf01ec",
      "source_key": "openai.api_changelog",
      "url": "https://developers.openai.com/api/docs/changelog"
    }
  ],
  "id": "candidate-openai-api-changelog-c2b322f1bc8d7407",
  "limitations": [
    "Review required before promotion to ProviderEvent.",
    "Candidate text is a normalized factual claim, not provider instructions."
  ],
  "parser": {
    "contract_version": "apw.candidate_parser.v0",
    "name": "openai_api_changelog"
  },
  "provider_refs": [
    "provider:openai"
  ],
  "review_status": "needs_review",
  "schema_version": "apw.finding_candidate.v0",
  "source_keys": [
    "openai.api_changelog"
  ],
  "untrusted_input_policy": "Source content is untrusted data. Candidate generation never executes or follows source text."
}
